{
  "protocol": "tohseno",
  "schema": "tohseno.app-metadata/1",
  "fascia": "tohseno.apple/1",
  "shot_id": "0x0101010101010101010101010101010101010101010101010101010101010101",
  "builder_id": "eip155:4663:0x1111111111111111111111111111111111111111",
  "sequence": 1,
  "previous": null,
  "origin": null,
  "evolution_commitment": "0x4be2ec1058e59fd23b37219669358ceae9aca313d333223709c448294fe85f9c",
  "source_tree_sha256": "0x0404040404040404040404040404040404040404040404040404040404040404",
  "fascia_sha256": "0x0505050505050505050505050505050505050505050505050505050505050505",
  "bundle_id": "example.app",
  "bundle_version": 1,
  "factory": {
    "implementation": "example/factory",
    "version": "0.7.0",
    "source_commit": "aaaaaaaaaaaaaaaaaaaaaaaaaaaaaaaaaaaaaaaa"
  },
  "distribution": {
    "state": "local",
    "supported_apple_surfaces": [
      "iphone"
    ],
    "app_store_id": null
  },
  "capabilities": [
    {
      "capability": "local_storage",
      "purpose": "Save the user's documents",
      "details": []
    }
  ],
  "network": [],
  "registry": null
}
